{"Delta_T":[[0.9999999672845652,0.00017301446099891296,-0.0001884061159163782,0.0006838568738903984],[-0.00017300142026230984,0.999999982638844,6.923019789059119e-05,0.00036862066930856805],[0.00018841809047080311,-6.91976011000555e-05,0.9999999798551573,0.0005310237319904121],[0.0,0.0,0.0,1.0]],"T0":[[1.0,0.0,0.0,0.0],[0.0,1.0,0.0,0.0],[0.0,0.0,1.0,0.0],[0.0,0.0,0.0,1.0]],"T_est":[[0.9999999672845652,0.00017301446099891296,-0.0001884061159163782,0.0006838568738903984],[-0.00017300142026230984,0.999999982638844,6.923019789059119e-05,0.00036862066930856805],[0.00018841809047080311,-6.91976011000555e-05,0.9999999798551573,0.0005310237319904121],[0.0,0.0,0.0,1.0]],"T_reference_nominal":[[1.0,0.0,0.0,0.0],[0.0,1.0,0.0,0.0],[0.0,0.0,1.0,0.0],[0.0,0.0,0.0,1.0]],"accepted_source_turnover":0.0,"active_amendment_sha256":"0f9681af0e23632926a69423c44e945abc0153a3aba9358412d5f38cc1516ec6","amendment_id":"FMB1_ZERO_PERTURBATION_MAINLINE_V1_1_R1","analysis_contract_sha256":"4120847bb471efbdbd32026ac23e959ab9ae4236709cf599b6e15701eb8b153d","attempt":1,"backend":"OPEN3D_POINT_TO_PLANE","backend_canonical_parameter_sha256":"94a2d1e991658b7088be43ad1a82f9b1d783264736c3beb0217d6dd1c7a26413","backend_parameter_contract_sha256":"6a1ebdee6b34390f1430eab371e1c4108db1f124b59b7239d74785efa6474af9","backend_version":"0.19.0+b012259","batch_id":"FMB1","code_commit":"c2702b266c427e108209d476bb5e07c3292735c5","common_association_invalid_detail":null,"common_association_invalid_reason":null,"common_association_valid":true,"correspondence_count_change_ratio":0.0,"correspondence_turnover":0.05867377863983514,"created_at_utc":"2026-08-20T08:49:02.509862+00:00","environment_identity":{"environment_manifest_sha256":"e7637921f841d9c7a4ee667dca471ae682afa71f4943eee0a15ef2678e54686e","numpy":"1.26.4","open3d":"0.19.0+b012259","pcl":"1.15.1","python":"3.11.15","scipy":"1.11.4"},"execution_kind":"FORMAL","final_correspondence_count":16014,"final_residual_rmse":0.008310873767867814,"final_valid_normal_correspondence_count":16014,"finite_result":true,"fixture_only":false,"formal_lock_sha256":"f7349142d8a5b3dd0277f64672297017366725c1d47de870580bf5bec4c4dd30","geometry_class":"RICH","infrastructure_status":"OK","initial_correspondence_count":16014,"initial_residual_rmse":0.008329267996353844,"initial_valid_normal_correspondence_count":16014,"median_normal_angle_change_deg":0.0,"physical_reference_semantics":"NOMINAL_IDENTITY_NO_OBVIOUS_MOTION_NOT_SUBMILLIMETER_GT","q95_normal_angle_change_deg":8.537736462515939e-07,"residual_rmse_change":-1.8394228486030145e-05,"retry_eligible":false,"retry_reason":null,"rotation_angle_deg":0.01518299602797241,"rotation_angle_rad":0.00026499327100533963,"scene_id":"FMB1_R01","schema":"mid360_fmb1_zero_perturbation_trial_result_v1_1_r1","scientific_status":"COMPLETED","snapshot_id":"FMB1_R01_S01_Q09","solver_status":"completed_finite_correspondences","source_reference":"/home/lj/ZPRM/zero_perturbation_runtime/mid360_formal_batch1_ingest_v1/snapshots/FMB1_R01/S01/FMB1_R01_S01_Q09.npy","source_sha256":"6c8abaf6f9e5b4ba9e71f9f0c8a94e718210d6a4538f4ba7c9c62cc723aa1dbe","station_id":"S01","target_reference":"/home/lj/ZPRM/zero_perturbation_runtime/mid360_formal_batch1_ingest_v1/targets/FMB1_R01/S01/target_points.npy","target_sha256":"720673d9b628a1f642026936b6fec5fb3e59a4f7472f5f84713a4f1d99756ad2","track_id":"ZERO_PERTURBATION_TRACK","translation_norm_m":0.0009410247742464966,"translation_x_m":0.0006838568738903984,"translation_y_m":0.00036862066930856805,"translation_z_m":0.0005310237319904121,"trial_id":"FMB1-ZP11R1-FMB1-R01-S01-Q09-O3D","trial_plan_sha256":"e96917f93ffbcccf0e2c1d75ee75ba86e342f08a9e4651732e2457b7ad867427"}
