{"Delta_T":[[1.0,5.719558248529211e-05,0.00022332837397698313,-0.0003045342746190727],[-5.719615000998601e-05,1.0,2.5147051019303035e-06,0.00010575688065728173],[-0.00022332822845783085,-2.5274785002693534e-06,1.0,0.0006950924871489406],[0.0,0.0,0.0,1.0]],"T0":[[1.0,0.0,0.0,0.0],[0.0,1.0,0.0,0.0],[0.0,0.0,1.0,0.0],[0.0,0.0,0.0,1.0]],"T_est":[[1.0,5.719558248529211e-05,0.00022332837397698313,-0.0003045342746190727],[-5.719615000998601e-05,1.0,2.5147051019303035e-06,0.00010575688065728173],[-0.00022332822845783085,-2.5274785002693534e-06,1.0,0.0006950924871489406],[0.0,0.0,0.0,1.0]],"T_reference_nominal":[[1.0,0.0,0.0,0.0],[0.0,1.0,0.0,0.0],[0.0,0.0,1.0,0.0],[0.0,0.0,0.0,1.0]],"accepted_source_turnover":0.0,"active_amendment_sha256":"0f9681af0e23632926a69423c44e945abc0153a3aba9358412d5f38cc1516ec6","amendment_id":"FMB1_ZERO_PERTURBATION_MAINLINE_V1_1_R1","analysis_contract_sha256":"4120847bb471efbdbd32026ac23e959ab9ae4236709cf599b6e15701eb8b153d","attempt":1,"backend":"PCL_POINT_TO_PLANE","backend_canonical_parameter_sha256":"16b3d124f466f33c41a1ecfb27a103a570c3ad2055db9c87ae92c74dbba64abd","backend_parameter_contract_sha256":"6a1ebdee6b34390f1430eab371e1c4108db1f124b59b7239d74785efa6474af9","backend_version":"1.15.1","batch_id":"FMB1","code_commit":"c2702b266c427e108209d476bb5e07c3292735c5","common_association_invalid_detail":null,"common_association_invalid_reason":null,"common_association_valid":true,"correspondence_count_change_ratio":0.0,"correspondence_turnover":0.046415613661954236,"created_at_utc":"2026-08-20T08:53:41.405794+00:00","environment_identity":{"environment_manifest_sha256":"e7637921f841d9c7a4ee667dca471ae682afa71f4943eee0a15ef2678e54686e","numpy":"1.26.4","open3d":"0.19.0+b012259","pcl":"1.15.1","python":"3.11.15","scipy":"1.11.4"},"execution_kind":"FORMAL","final_correspondence_count":15615,"final_residual_rmse":0.006157041366854505,"final_valid_normal_correspondence_count":15615,"finite_result":true,"fixture_only":false,"formal_lock_sha256":"f7349142d8a5b3dd0277f64672297017366725c1d47de870580bf5bec4c4dd30","geometry_class":"WEAK","infrastructure_status":"OK","initial_correspondence_count":15615,"initial_residual_rmse":0.00616996103387985,"initial_valid_normal_correspondence_count":15615,"median_normal_angle_change_deg":0.0,"physical_reference_semantics":"NOMINAL_IDENTITY_NO_OBVIOUS_MOTION_NOT_SUBMILLIMETER_GT","q95_normal_angle_change_deg":8.537736462515939e-07,"residual_rmse_change":-1.2919667025344805e-05,"retry_eligible":false,"retry_reason":null,"rotation_angle_deg":0.013209535620132457,"rotation_angle_rad":0.00023054988923078233,"scene_id":"FMB1_W03","schema":"mid360_fmb1_zero_perturbation_trial_result_v1_1_r1","scientific_status":"COMPLETED","snapshot_id":"FMB1_W03_S02_Q03","solver_status":"completed_finite_correspondences","source_reference":"/home/lj/ZPRM/zero_perturbation_runtime/mid360_formal_batch1_ingest_v1/snapshots/FMB1_W03/S02/FMB1_W03_S02_Q03.npy","source_sha256":"acbcdf21bac735e0f4c976fc1af68b50bfdb6f70cb3dacdf5d1679df2ef09f78","station_id":"S02","target_reference":"/home/lj/ZPRM/zero_perturbation_runtime/mid360_formal_batch1_ingest_v1/targets/FMB1_W03/S02/target_points.npy","target_sha256":"db23d98d22361f9d1782a118ae00160662da81ab5dcaec618b28c8d945a53b7d","track_id":"ZERO_PERTURBATION_TRACK","translation_norm_m":0.0007662109421791256,"translation_x_m":-0.0003045342746190727,"translation_y_m":0.00010575688065728173,"translation_z_m":0.0006950924871489406,"trial_id":"FMB1-ZP11R1-FMB1-W03-S02-Q03-PCL","trial_plan_sha256":"e96917f93ffbcccf0e2c1d75ee75ba86e342f08a9e4651732e2457b7ad867427"}
