{"Delta_T":[[0.9999999986832845,-4.4038045203600555e-05,-2.6345431680503544e-05,-0.00022945894085397794],[4.403770049719255e-05,0.999999998944738,-1.3084542535817069e-05,-5.8024134655683765e-05],[2.6346007870377867e-05,1.3083382326358628e-05,0.9999999995673565,5.365492955828723e-06],[0.0,0.0,0.0,1.0]],"T0":[[1.0,0.0,0.0,0.0],[0.0,1.0,0.0,0.0],[0.0,0.0,1.0,0.0],[0.0,0.0,0.0,1.0]],"T_est":[[0.9999999986832845,-4.4038045203600555e-05,-2.6345431680503544e-05,-0.00022945894085397794],[4.403770049719255e-05,0.999999998944738,-1.3084542535817069e-05,-5.8024134655683765e-05],[2.6346007870377867e-05,1.3083382326358628e-05,0.9999999995673565,5.365492955828723e-06],[0.0,0.0,0.0,1.0]],"T_reference_nominal":[[1.0,0.0,0.0,0.0],[0.0,1.0,0.0,0.0],[0.0,0.0,1.0,0.0],[0.0,0.0,0.0,1.0]],"accepted_source_turnover":0.0,"active_amendment_sha256":"0f9681af0e23632926a69423c44e945abc0153a3aba9358412d5f38cc1516ec6","amendment_id":"FMB1_ZERO_PERTURBATION_MAINLINE_V1_1_R1","analysis_contract_sha256":"4120847bb471efbdbd32026ac23e959ab9ae4236709cf599b6e15701eb8b153d","attempt":2,"backend":"OPEN3D_POINT_TO_PLANE","backend_canonical_parameter_sha256":"94a2d1e991658b7088be43ad1a82f9b1d783264736c3beb0217d6dd1c7a26413","backend_parameter_contract_sha256":"6a1ebdee6b34390f1430eab371e1c4108db1f124b59b7239d74785efa6474af9","backend_version":"0.19.0+b012259","batch_id":"FMB1","code_commit":"c2702b266c427e108209d476bb5e07c3292735c5","common_association_invalid_detail":null,"common_association_invalid_reason":null,"common_association_valid":true,"correspondence_count_change_ratio":0.0,"correspondence_turnover":0.015351014040561606,"created_at_utc":"2026-08-20T08:52:25.344392+00:00","environment_identity":{"environment_manifest_sha256":"e7637921f841d9c7a4ee667dca471ae682afa71f4943eee0a15ef2678e54686e","numpy":"1.26.4","open3d":"0.19.0+b012259","pcl":"1.15.1","python":"3.11.15","scipy":"1.11.4"},"execution_kind":"FORMAL","final_correspondence_count":15902,"final_residual_rmse":0.0055152992494923135,"final_valid_normal_correspondence_count":15902,"finite_result":true,"fixture_only":false,"formal_lock_sha256":"f7349142d8a5b3dd0277f64672297017366725c1d47de870580bf5bec4c4dd30","geometry_class":"WEAK","infrastructure_status":"OK","initial_correspondence_count":15902,"initial_residual_rmse":0.005520783935349388,"initial_valid_normal_correspondence_count":15902,"median_normal_angle_change_deg":0.0,"physical_reference_semantics":"NOMINAL_IDENTITY_NO_OBVIOUS_MOTION_NOT_SUBMILLIMETER_GT","q95_normal_angle_change_deg":8.537736462515939e-07,"residual_rmse_change":-5.4846858570743034e-06,"retry_eligible":false,"retry_reason":null,"rotation_angle_deg":0.0030343085733743535,"rotation_angle_rad":5.295867512687441e-05,"scene_id":"FMB1_W02","schema":"mid360_fmb1_zero_perturbation_trial_result_v1_1_r1","scientific_status":"COMPLETED","snapshot_id":"FMB1_W02_S01_Q03","solver_status":"completed_finite_correspondences","source_reference":"/home/lj/ZPRM/zero_perturbation_runtime/mid360_formal_batch1_w02_attempt2_v1/snapshots/FMB1_W02/S01/FMB1_W02_S01_Q03.npy","source_sha256":"b4b96273b1c323980cc679d8e23702312b2c54f0d9c6d2f6c7525273dbf62371","station_id":"S01","target_reference":"/home/lj/ZPRM/zero_perturbation_runtime/mid360_formal_batch1_w02_attempt2_v1/targets/FMB1_W02/S01/target_points.npy","target_sha256":"faea55914993c660e754ef85c26d310e9bc18a0de8ccb197e3bdfe046255423a","track_id":"ZERO_PERTURBATION_TRACK","translation_norm_m":0.0002367424639878307,"translation_x_m":-0.00022945894085397794,"translation_y_m":-5.8024134655683765e-05,"translation_z_m":5.365492955828723e-06,"trial_id":"FMB1-ZP11R1-FMB1-W02-S01-Q03-O3D","trial_plan_sha256":"e96917f93ffbcccf0e2c1d75ee75ba86e342f08a9e4651732e2457b7ad867427"}
